{
  "policies": {
    "function-structure-backlog": {
      "evidence": [
        "docs/ARCHITECTURE.md",
        "docs/PUBLIC_CONTRACTS.md",
        "python run_tests.py"
      ],
      "rationale": "Long-function and helper-extraction recommendations remain explicit maintenance work. They are not confirmed defects and must not be conflated with vulnerabilities.",
      "status": "maintenance-open"
    },
    "generated-stub-secret-pattern": {
      "evidence": [
        "pegrex/roundtrip.py:87-88",
        "tests/test_roundtrip.py",
        "No credentials, secrets, or external services are used by this code path"
      ],
      "rationale": "The scanner matches adjacent old/new client dictionary keys, not a credential value. Both expressions select the same generated Go client stub; no API key or secret is present.",
      "status": "false-positive"
    },
    "intentional-process-state": {
      "evidence": [
        "pegrex/smt.py:get_backend/set_backend",
        "pegrex/work.py:_rules",
        "pegrex/zkproof.py:_ensure_group",
        "tests/test_work.py",
        "tests/test_zkproof.py"
      ],
      "rationale": "The solver backend selector, compiled grammar cache, and validated ZK group cache are intentional process-local configuration or memoization. Their behavior and thread-safety boundaries are covered without changing public contracts.",
      "status": "accepted-design"
    },
    "module-structure-backlog": {
      "evidence": [
        "docs/ARCHITECTURE.md",
        "docs/PUBLIC_CONTRACTS.md",
        "python run_tests.py"
      ],
      "rationale": "Module-size thresholds identify candidates for future contract-preserving decomposition. Size alone is not a correctness or security defect; broad restructuring is intentionally deferred.",
      "status": "maintenance-open"
    },
    "operator-code-execution": {
      "evidence": [
        "README.md:Intentional code execution boundaries",
        "docs/PUBLIC_CONTRACTS.md",
        "pegrex/commands/verification.py:_cmd_concolic",
        "tests/test_production_hardening.py"
      ],
      "rationale": "The concolic CLI intentionally loads and executes the operator-selected source before tracing it. This is an explicit code-execution interface, not a passive audit path; untrusted input requires an external isolated sandbox.",
      "status": "accepted-risk"
    },
    "test-evidence-backlog": {
      "evidence": [
        "python run_tests.py",
        "tests/ (direct and indirect regressions)",
        "specs/pegrex_health.spec.json (static untested-function tasks)"
      ],
      "rationale": "Static reference analysis found no direct test reference for these functions. This is a test-evidence gap, not proof that runtime coverage or indirect regression coverage is absent.",
      "status": "maintenance-open"
    }
  },
  "report_sha256": "2d7438cbc0b06cd1358c9861dd0fffa1c31013fbe3786142d1883176cec81274",
  "schema": "pegrex.health-dispositions.v1",
  "tasks": {
    "T01": "operator-code-execution",
    "T02": "operator-code-execution",
    "T03": "function-structure-backlog",
    "T04": "function-structure-backlog",
    "T05": "function-structure-backlog",
    "T06": "function-structure-backlog",
    "T07": "function-structure-backlog",
    "T08": "function-structure-backlog",
    "T09": "function-structure-backlog",
    "T10": "function-structure-backlog",
    "T100": "function-structure-backlog",
    "T101": "function-structure-backlog",
    "T102": "function-structure-backlog",
    "T103": "function-structure-backlog",
    "T104": "function-structure-backlog",
    "T105": "function-structure-backlog",
    "T106": "function-structure-backlog",
    "T107": "function-structure-backlog",
    "T108": "function-structure-backlog",
    "T109": "function-structure-backlog",
    "T11": "function-structure-backlog",
    "T110": "function-structure-backlog",
    "T111": "function-structure-backlog",
    "T112": "function-structure-backlog",
    "T113": "function-structure-backlog",
    "T114": "function-structure-backlog",
    "T115": "function-structure-backlog",
    "T116": "function-structure-backlog",
    "T117": "function-structure-backlog",
    "T118": "function-structure-backlog",
    "T119": "function-structure-backlog",
    "T12": "function-structure-backlog",
    "T120": "function-structure-backlog",
    "T121": "function-structure-backlog",
    "T122": "function-structure-backlog",
    "T123": "function-structure-backlog",
    "T124": "function-structure-backlog",
    "T125": "function-structure-backlog",
    "T126": "function-structure-backlog",
    "T127": "function-structure-backlog",
    "T128": "function-structure-backlog",
    "T129": "function-structure-backlog",
    "T13": "function-structure-backlog",
    "T130": "function-structure-backlog",
    "T131": "function-structure-backlog",
    "T132": "function-structure-backlog",
    "T133": "function-structure-backlog",
    "T134": "function-structure-backlog",
    "T135": "function-structure-backlog",
    "T136": "function-structure-backlog",
    "T137": "function-structure-backlog",
    "T138": "function-structure-backlog",
    "T139": "function-structure-backlog",
    "T14": "function-structure-backlog",
    "T140": "function-structure-backlog",
    "T141": "function-structure-backlog",
    "T142": "function-structure-backlog",
    "T143": "function-structure-backlog",
    "T144": "function-structure-backlog",
    "T145": "function-structure-backlog",
    "T146": "function-structure-backlog",
    "T147": "function-structure-backlog",
    "T148": "function-structure-backlog",
    "T149": "function-structure-backlog",
    "T15": "function-structure-backlog",
    "T150": "function-structure-backlog",
    "T151": "function-structure-backlog",
    "T152": "function-structure-backlog",
    "T153": "function-structure-backlog",
    "T154": "function-structure-backlog",
    "T155": "function-structure-backlog",
    "T156": "function-structure-backlog",
    "T157": "function-structure-backlog",
    "T158": "function-structure-backlog",
    "T159": "function-structure-backlog",
    "T16": "function-structure-backlog",
    "T160": "function-structure-backlog",
    "T161": "function-structure-backlog",
    "T162": "function-structure-backlog",
    "T163": "function-structure-backlog",
    "T164": "function-structure-backlog",
    "T165": "function-structure-backlog",
    "T166": "function-structure-backlog",
    "T167": "function-structure-backlog",
    "T168": "intentional-process-state",
    "T169": "function-structure-backlog",
    "T17": "function-structure-backlog",
    "T170": "function-structure-backlog",
    "T171": "function-structure-backlog",
    "T172": "function-structure-backlog",
    "T173": "function-structure-backlog",
    "T174": "function-structure-backlog",
    "T175": "function-structure-backlog",
    "T176": "function-structure-backlog",
    "T177": "function-structure-backlog",
    "T178": "function-structure-backlog",
    "T179": "function-structure-backlog",
    "T18": "function-structure-backlog",
    "T180": "function-structure-backlog",
    "T181": "function-structure-backlog",
    "T182": "function-structure-backlog",
    "T183": "function-structure-backlog",
    "T184": "function-structure-backlog",
    "T185": "function-structure-backlog",
    "T186": "function-structure-backlog",
    "T187": "function-structure-backlog",
    "T188": "function-structure-backlog",
    "T189": "function-structure-backlog",
    "T19": "function-structure-backlog",
    "T190": "function-structure-backlog",
    "T191": "intentional-process-state",
    "T192": "function-structure-backlog",
    "T193": "function-structure-backlog",
    "T194": "function-structure-backlog",
    "T195": "intentional-process-state",
    "T196": "test-evidence-backlog",
    "T197": "test-evidence-backlog",
    "T198": "test-evidence-backlog",
    "T199": "test-evidence-backlog",
    "T20": "function-structure-backlog",
    "T200": "test-evidence-backlog",
    "T201": "test-evidence-backlog",
    "T202": "test-evidence-backlog",
    "T203": "test-evidence-backlog",
    "T204": "test-evidence-backlog",
    "T205": "test-evidence-backlog",
    "T206": "test-evidence-backlog",
    "T207": "test-evidence-backlog",
    "T208": "test-evidence-backlog",
    "T209": "test-evidence-backlog",
    "T21": "function-structure-backlog",
    "T210": "test-evidence-backlog",
    "T211": "test-evidence-backlog",
    "T212": "test-evidence-backlog",
    "T213": "test-evidence-backlog",
    "T214": "test-evidence-backlog",
    "T215": "test-evidence-backlog",
    "T216": "test-evidence-backlog",
    "T217": "test-evidence-backlog",
    "T218": "test-evidence-backlog",
    "T219": "test-evidence-backlog",
    "T22": "function-structure-backlog",
    "T220": "test-evidence-backlog",
    "T221": "test-evidence-backlog",
    "T222": "test-evidence-backlog",
    "T223": "test-evidence-backlog",
    "T224": "test-evidence-backlog",
    "T225": "test-evidence-backlog",
    "T226": "test-evidence-backlog",
    "T227": "test-evidence-backlog",
    "T228": "test-evidence-backlog",
    "T229": "test-evidence-backlog",
    "T23": "function-structure-backlog",
    "T230": "test-evidence-backlog",
    "T231": "test-evidence-backlog",
    "T232": "test-evidence-backlog",
    "T233": "test-evidence-backlog",
    "T234": "test-evidence-backlog",
    "T235": "test-evidence-backlog",
    "T236": "test-evidence-backlog",
    "T237": "test-evidence-backlog",
    "T238": "test-evidence-backlog",
    "T239": "test-evidence-backlog",
    "T24": "function-structure-backlog",
    "T240": "test-evidence-backlog",
    "T241": "test-evidence-backlog",
    "T242": "test-evidence-backlog",
    "T243": "test-evidence-backlog",
    "T244": "test-evidence-backlog",
    "T245": "test-evidence-backlog",
    "T246": "test-evidence-backlog",
    "T247": "test-evidence-backlog",
    "T248": "test-evidence-backlog",
    "T249": "test-evidence-backlog",